{
  "$schema": "https://json-schema.org/draft/2020-12/schema",
  "$id": "https://atahprotocol.org/spec/v0.8/schemas/profession-category.schema.json",
  "title": "ATAH Profession Category",
  "description": "ATAH Registry Operation Profile object: profession category metadata record (spec/v0.8 §4.4). Per F1.10 / F1.11 (Paolo's stratified-randomisation position), v0.8.2 replaces the v0.8.1 `matching_weight_profile` with `band_definitions`: each category declares its own bands (name, position, threshold rule), and ordering within the band uses a documented fairness policy. Per F-7, the v0.8.1 `review_signal_weight_cap` is replaced with `review_signal_band_cap`, preserving the original safeguard under the band-based model. The matching engine that consumes these fields is documented in §9 of `full-spec.md`. Required for implementations claiming Registry Conformance.",
  "type": "object",
  "properties": {
    "category_id": {
      "type": "string",
      "minLength": 1,
      "pattern": "^[a-z][a-z0-9_]*$"
    },
    "schema_version": { "type": "string", "const": "0.8" },
    "category_name": { "type": "string", "minLength": 1 },
    "professional_tier": {
      "type": "string",
      "enum": ["credentialled", "established"]
    },
    "body_membership_type": {
      "type": "string",
      "enum": [
        "mandatory_per_jurisdiction",
        "mandatory_global",
        "optional_with_strong_signal",
        "optional_with_weak_signal",
        "none"
      ]
    },
    "compliance_status": {
      "type": "string",
      "enum": ["active", "compliance-pending", "not-supported"]
    },
    "default_pre_handoff_check": {
      "type": "string",
      "enum": ["conflict_check", "scope_confirmation", "capacity_confirmation", "fee_alignment", "none"]
    },
    "band_definitions": {
      "type": "array",
      "description": "Per-category band specifications used by the §9 matching engine. Each band has a name, a position (lower = higher band; a candidate in band_position 1 appears before a candidate in band_position 2 in the response), and a threshold rule describing the predicate a candidate must satisfy to be in this band. The threshold-rule grammar is implementation-defined for v0.8.2 (a free-text predicate using documented signals); v0.9 may standardise it. The default bands across launch categories are `verification_confidence`, `category_fit`, `availability_window`, and `contact_freshness`; categories MAY define more or different bands as long as the band assignment behaviour is observable through `match-response.schema.json` `band_assignment`.",
      "items": {
        "type": "object",
        "properties": {
          "band_name": { "type": "string", "minLength": 1 },
          "band_position": { "type": "integer", "minimum": 1 },
          "threshold_rule": { "type": "string", "minLength": 1 }
        },
        "required": ["band_name", "band_position", "threshold_rule"],
        "additionalProperties": false
      },
      "minItems": 1
    },
    "review_signal_band_cap": {
      "type": "object",
      "description": "Per F-7, this field replaces the v0.8.1 `review_signal_weight_cap`. The cap preserves the original safeguard under the band-based model: review-derived signals MAY supplement transparency and confidence metadata, but for high-stakes regulated categories MUST NOT move a candidate into a higher eligibility or verification band unless corroborated by authoritative credential or regulator-source evidence. High-stakes regulated categories set `may_upgrade_band: false` and `regulated_category_max_effect: no_band_upgrade`. Lower-stakes categories MAY permit `may_upgrade_band: true` with documented authoritative-corroboration requirements.",
      "properties": {
        "max_band_influence": {
          "type": "string",
          "enum": ["supplemental_only", "not_applicable"]
        },
        "may_upgrade_band": {
          "type": "boolean"
        },
        "regulated_category_max_effect": {
          "type": "string",
          "enum": ["no_band_upgrade", "documented_corroboration_required", "not_applicable"]
        }
      },
      "required": ["max_band_influence", "may_upgrade_band", "regulated_category_max_effect"],
      "additionalProperties": false
    },
    "stage2_auth_tier": {
      "type": "string",
      "enum": ["tier_1", "tier_2", "tier_3"]
    },
    "referral_proposal_expiry_months": {
      "type": "integer",
      "minimum": 1,
      "maximum": 36,
      "description": "Default expiry for Component 3 referral proposals targeting professionals in this category, in months. Categories without a value use the protocol-level default of 6 months. v0.8.2 ships with 6 as the only populated value across categories."
    },
    "contact_verification_cadence": {
      "type": "string",
      "enum": ["quarterly", "biannual", "annual", "none"],
      "description": "Per-category cadence for Layer 1 periodic contact-channel verification (per spec §12A). High-stakes regulated categories (credentialled tier with mandatory body membership) typically use `quarterly`; mid-stakes regulated `biannual`; established practitioners `annual`. Categories without a value use the protocol-level default of `annual`. The cadence drives when ATAH issues verification challenges to the professional's `notification_channels`; missed challenges escalate per §12A Layer 2 and may flip `matching_status` to `contact_unverified`. The field is per-category configurable so launch categories can be tuned individually without a schema change."
    },
    "pre_handoff_freshness_window_days": {
      "type": "integer",
      "minimum": 1,
      "maximum": 365,
      "description": "Per-category recency window (in days) for Layer 3 pre-handoff freshness check (per spec §12A). Only populated for high-stakes categories where a just-in-time verification before sending the introduction notification is warranted. v0.8.2 ships with 30 as the populated value for high-stakes categories. Absent for categories that do not require Layer 3 (the protocol does not run Layer 3 for those categories)."
    }
  },
  "required": [
    "category_id",
    "schema_version",
    "category_name",
    "professional_tier",
    "body_membership_type",
    "compliance_status",
    "default_pre_handoff_check",
    "band_definitions",
    "review_signal_band_cap",
    "stage2_auth_tier",
    "contact_verification_cadence"
  ],
  "additionalProperties": false,
  "examples": [
    {
      "category_id": "lawyer",
      "schema_version": "0.8",
      "category_name": "Lawyer",
      "professional_tier": "credentialled",
      "body_membership_type": "mandatory_per_jurisdiction",
      "compliance_status": "active",
      "default_pre_handoff_check": "conflict_check",
      "band_definitions": [
        { "band_name": "verification_confidence", "band_position": 1, "threshold_rule": "verification_confidence == multi_source_corroborated OR multi_source_with_enhanced_verification" },
        { "band_name": "verification_confidence", "band_position": 2, "threshold_rule": "verification_confidence == single_source_regulator OR single_source_membership" },
        { "band_name": "category_fit", "band_position": 1, "threshold_rule": "category_fit >= 0.7" },
        { "band_name": "availability_window", "band_position": 1, "threshold_rule": "availability_score >= 0.8 AND response_time_hours <= 24" },
        { "band_name": "contact_freshness", "band_position": 1, "threshold_rule": "contact_unverified == false" }
      ],
      "review_signal_band_cap": {
        "max_band_influence": "supplemental_only",
        "may_upgrade_band": false,
        "regulated_category_max_effect": "no_band_upgrade"
      },
      "stage2_auth_tier": "tier_2",
      "referral_proposal_expiry_months": 6,
      "contact_verification_cadence": "quarterly",
      "pre_handoff_freshness_window_days": 30
    },
    {
      "category_id": "executive_coach",
      "schema_version": "0.8",
      "category_name": "Executive Coach",
      "professional_tier": "established",
      "body_membership_type": "optional_with_weak_signal",
      "compliance_status": "active",
      "default_pre_handoff_check": "scope_confirmation",
      "band_definitions": [
        { "band_name": "verification_confidence", "band_position": 1, "threshold_rule": "verification_confidence == multi_source_corroborated OR multi_source_with_enhanced_verification" },
        { "band_name": "verification_confidence", "band_position": 2, "threshold_rule": "verification_confidence == single_source_membership OR single_source_self_declared" },
        { "band_name": "category_fit", "band_position": 1, "threshold_rule": "category_fit >= 0.6" },
        { "band_name": "availability_window", "band_position": 1, "threshold_rule": "availability_score >= 0.7" },
        { "band_name": "contact_freshness", "band_position": 1, "threshold_rule": "contact_unverified == false" }
      ],
      "review_signal_band_cap": {
        "max_band_influence": "supplemental_only",
        "may_upgrade_band": true,
        "regulated_category_max_effect": "documented_corroboration_required"
      },
      "stage2_auth_tier": "tier_1",
      "referral_proposal_expiry_months": 6,
      "contact_verification_cadence": "annual"
    }
  ]
}
