[
  {
    "category_id": "lawyer",
    "schema_version": "0.8",
    "category_name": "Lawyer",
    "professional_tier": "credentialled",
    "body_membership_type": "mandatory_per_jurisdiction",
    "compliance_status": "active",
    "default_pre_handoff_check": "conflict_check",
    "stage2_auth_tier": "tier_2",
    "referral_proposal_expiry_months": 6,
    "band_definitions": [
      {
        "band_name": "verification_confidence",
        "band_position": 1,
        "threshold_rule": "verification_confidence == multi_source_corroborated OR multi_source_with_enhanced_verification"
      },
      {
        "band_name": "verification_confidence",
        "band_position": 2,
        "threshold_rule": "verification_confidence == single_source_regulator OR single_source_membership"
      },
      {
        "band_name": "category_fit",
        "band_position": 1,
        "threshold_rule": "category_fit >= 0.7"
      },
      {
        "band_name": "availability_window",
        "band_position": 1,
        "threshold_rule": "availability_score >= 0.8 AND response_time_hours <= 24"
      },
      {
        "band_name": "contact_freshness",
        "band_position": 1,
        "threshold_rule": "contact_unverified == false"
      }
    ],
    "review_signal_band_cap": {
      "max_band_influence": "supplemental_only",
      "may_upgrade_band": false,
      "regulated_category_max_effect": "no_band_upgrade"
    },
    "contact_verification_cadence": "quarterly",
    "pre_handoff_freshness_window_days": 30
  },
  {
    "category_id": "pr_professional",
    "schema_version": "0.8",
    "category_name": "PR Professional",
    "professional_tier": "established",
    "body_membership_type": "optional_with_strong_signal",
    "compliance_status": "active",
    "default_pre_handoff_check": "scope_confirmation",
    "stage2_auth_tier": "tier_1",
    "referral_proposal_expiry_months": 6,
    "band_definitions": [
      {
        "band_name": "verification_confidence",
        "band_position": 1,
        "threshold_rule": "verification_confidence == multi_source_corroborated OR multi_source_with_enhanced_verification"
      },
      {
        "band_name": "verification_confidence",
        "band_position": 2,
        "threshold_rule": "verification_confidence == single_source_membership OR single_source_self_declared"
      },
      {
        "band_name": "category_fit",
        "band_position": 1,
        "threshold_rule": "category_fit >= 0.6"
      },
      {
        "band_name": "availability_window",
        "band_position": 1,
        "threshold_rule": "availability_score >= 0.7"
      },
      {
        "band_name": "contact_freshness",
        "band_position": 1,
        "threshold_rule": "contact_unverified == false"
      }
    ],
    "review_signal_band_cap": {
      "max_band_influence": "supplemental_only",
      "may_upgrade_band": true,
      "regulated_category_max_effect": "documented_corroboration_required"
    },
    "contact_verification_cadence": "annual"
  },
  {
    "category_id": "physician",
    "schema_version": "0.8",
    "category_name": "Physician",
    "professional_tier": "credentialled",
    "body_membership_type": "mandatory_per_jurisdiction",
    "compliance_status": "compliance-pending",
    "default_pre_handoff_check": "capacity_confirmation",
    "stage2_auth_tier": "tier_3",
    "referral_proposal_expiry_months": 6,
    "band_definitions": [
      {
        "band_name": "verification_confidence",
        "band_position": 1,
        "threshold_rule": "verification_confidence == multi_source_corroborated OR multi_source_with_enhanced_verification"
      },
      {
        "band_name": "verification_confidence",
        "band_position": 2,
        "threshold_rule": "verification_confidence == single_source_regulator OR single_source_membership"
      },
      {
        "band_name": "category_fit",
        "band_position": 1,
        "threshold_rule": "category_fit >= 0.7"
      },
      {
        "band_name": "availability_window",
        "band_position": 1,
        "threshold_rule": "availability_score >= 0.8 AND response_time_hours <= 24"
      },
      {
        "band_name": "contact_freshness",
        "band_position": 1,
        "threshold_rule": "contact_unverified == false"
      }
    ],
    "review_signal_band_cap": {
      "max_band_influence": "supplemental_only",
      "may_upgrade_band": false,
      "regulated_category_max_effect": "no_band_upgrade"
    },
    "contact_verification_cadence": "quarterly",
    "pre_handoff_freshness_window_days": 30
  },
  {
    "category_id": "tax_planner",
    "schema_version": "0.8",
    "category_name": "Tax Planner",
    "professional_tier": "established",
    "body_membership_type": "optional_with_strong_signal",
    "compliance_status": "active",
    "default_pre_handoff_check": "scope_confirmation",
    "stage2_auth_tier": "tier_2",
    "referral_proposal_expiry_months": 6,
    "band_definitions": [
      {
        "band_name": "verification_confidence",
        "band_position": 1,
        "threshold_rule": "verification_confidence == multi_source_corroborated OR multi_source_with_enhanced_verification"
      },
      {
        "band_name": "verification_confidence",
        "band_position": 2,
        "threshold_rule": "verification_confidence == single_source_membership OR single_source_self_declared"
      },
      {
        "band_name": "category_fit",
        "band_position": 1,
        "threshold_rule": "category_fit >= 0.6"
      },
      {
        "band_name": "availability_window",
        "band_position": 1,
        "threshold_rule": "availability_score >= 0.7"
      },
      {
        "band_name": "contact_freshness",
        "band_position": 1,
        "threshold_rule": "contact_unverified == false"
      }
    ],
    "review_signal_band_cap": {
      "max_band_influence": "supplemental_only",
      "may_upgrade_band": true,
      "regulated_category_max_effect": "documented_corroboration_required"
    },
    "contact_verification_cadence": "annual"
  },
  {
    "category_id": "accountant",
    "schema_version": "0.8",
    "category_name": "Accountant",
    "professional_tier": "established",
    "body_membership_type": "optional_with_strong_signal",
    "compliance_status": "active",
    "default_pre_handoff_check": "scope_confirmation",
    "stage2_auth_tier": "tier_2",
    "referral_proposal_expiry_months": 6,
    "band_definitions": [
      {
        "band_name": "verification_confidence",
        "band_position": 1,
        "threshold_rule": "verification_confidence == multi_source_corroborated OR multi_source_with_enhanced_verification"
      },
      {
        "band_name": "verification_confidence",
        "band_position": 2,
        "threshold_rule": "verification_confidence == single_source_membership OR single_source_self_declared"
      },
      {
        "band_name": "category_fit",
        "band_position": 1,
        "threshold_rule": "category_fit >= 0.6"
      },
      {
        "band_name": "availability_window",
        "band_position": 1,
        "threshold_rule": "availability_score >= 0.7"
      },
      {
        "band_name": "contact_freshness",
        "band_position": 1,
        "threshold_rule": "contact_unverified == false"
      }
    ],
    "review_signal_band_cap": {
      "max_band_influence": "supplemental_only",
      "may_upgrade_band": true,
      "regulated_category_max_effect": "documented_corroboration_required"
    },
    "contact_verification_cadence": "annual"
  },
  {
    "category_id": "financial_advisor",
    "schema_version": "0.8",
    "category_name": "Financial Advisor",
    "professional_tier": "credentialled",
    "body_membership_type": "mandatory_per_jurisdiction",
    "compliance_status": "active",
    "default_pre_handoff_check": "scope_confirmation",
    "stage2_auth_tier": "tier_2",
    "referral_proposal_expiry_months": 6,
    "band_definitions": [
      {
        "band_name": "verification_confidence",
        "band_position": 1,
        "threshold_rule": "verification_confidence == multi_source_corroborated OR multi_source_with_enhanced_verification"
      },
      {
        "band_name": "verification_confidence",
        "band_position": 2,
        "threshold_rule": "verification_confidence == single_source_regulator OR single_source_membership"
      },
      {
        "band_name": "category_fit",
        "band_position": 1,
        "threshold_rule": "category_fit >= 0.7"
      },
      {
        "band_name": "availability_window",
        "band_position": 1,
        "threshold_rule": "availability_score >= 0.8 AND response_time_hours <= 24"
      },
      {
        "band_name": "contact_freshness",
        "band_position": 1,
        "threshold_rule": "contact_unverified == false"
      }
    ],
    "review_signal_band_cap": {
      "max_band_influence": "supplemental_only",
      "may_upgrade_band": false,
      "regulated_category_max_effect": "no_band_upgrade"
    },
    "contact_verification_cadence": "quarterly",
    "pre_handoff_freshness_window_days": 30
  },
  {
    "category_id": "insurance_agent_pc",
    "schema_version": "0.8",
    "category_name": "Insurance Agent (P&C)",
    "professional_tier": "credentialled",
    "body_membership_type": "mandatory_per_jurisdiction",
    "compliance_status": "active",
    "default_pre_handoff_check": "scope_confirmation",
    "stage2_auth_tier": "tier_2",
    "referral_proposal_expiry_months": 6,
    "band_definitions": [
      {
        "band_name": "verification_confidence",
        "band_position": 1,
        "threshold_rule": "verification_confidence == multi_source_corroborated OR multi_source_with_enhanced_verification"
      },
      {
        "band_name": "verification_confidence",
        "band_position": 2,
        "threshold_rule": "verification_confidence == single_source_regulator OR single_source_membership"
      },
      {
        "band_name": "category_fit",
        "band_position": 1,